<?xml version="1.0" encoding="UTF-8"?>
<InternetShop xmlns="http://by/it/ikavalenka/jd02_07/xml/InternetShop"
        xmlns:xsi="http://www.w3.org/2001/XMLSchema-instance"
    xsi:schemaLocation="http://by/it/ikavalenka/jd02_07/xml/InternetShop InShop.xsd">

    <Administrator login="zAds36" password='pass2'>
        <Catalog>CatalogAll</Catalog>
        <Order>12</Order>
        <BlackList>None</BlackList>
    </Administrator>

    <Client login="xAbz46" password='pass1'>
        <MadeOrder>OrderOne</MadeOrder>
        <PayOreder>1343.15</PayOreder>
    </Client>

    <OrderC>
        <Profit>Summary</Profit>
        <Count>AllDevice</Count>
        <Sale>Procent</Sale>
    </OrderC>

    <BlackListStatus>
        <Client_id>458</Client_id>
    </BlackListStatus>
</InternetShop>
